VII,7GC & Co. Holdings Inc. Class A common stock,,,United States,2021," 280,887,500 "
GPX,GP Strategies Corporation Common Stock,Miscellaneous,Service to the Health Industry,United States,," 280,876,672 "
MBII,Marrone Bio Innovations Inc. Common Stock,Basic Industries,Major Chemicals,United States,2013," 280,823,588 "
TCI,Transcontinental Realty Investors Inc. Common Stock,Finance,Real Estate,United States,," 280,777,770 "
PSTL,Postal Realty Trust Inc. Class A Common Stock,Consumer Services,Real Estate Investment Trusts,,2019," 280,653,554 "
ARBG,Aequi Acquisition Corp. Class A Common Stock,,,United States,2021," 280,312,500 "
EMX,EMX Royalty Corporation Common Shares (Canada),Basic Industries,Precious Metals,Canada,," 280,062,904 "
ASPC,Alpha Capital Acquisition Company One Class A Ordinary Share,Finance,Business Services,United States,2021," 279,737,500 "
FINS,Angel Oak Financial Strategies Income Term Trust Common Shares of Beneficial Interest,,,,2019," 279,299,823 "
PAQC,Provident Acquisition Corp. Class A Ordinary Shares,Finance,Business Services,Hong Kong,2021," 279,162,500 "
ITQ,Itiquira Acquisition Corp. Class A Ordinary Shares,Finance,Business Services,United States,2021," 279,162,500 "
BIOT,Biotech Acquisition Company Class A Ordinary Shares,Finance,Business Services,United States,2021," 279,162,500 "
OSTR,Oyster Enterprises Acquisition Corp. Class A Common Stock,,,United States,2021," 278,875,000 "
SHAC,SCP & CO Healthcare Acquisition Company Class A Common Stock,,,United States,2021," 278,875,000 "
LDHA,LDH Growth Corp I Class A Ordinary Shares,Finance,Business Services,United States,2021," 278,875,000 "
VELO,Velocity Acquisition Corp. Class A Common Stock,,,United States,2021," 278,587,500 "
BLTS,Bright Lights Acquisition Corp. Class A Common Stock,,,,2021," 278,587,500 "
HQI,HireQuest Inc. Common Stock (DE),Technology,Diversified Commercial Services,United States,," 278,462,114 "
BOAS,BOA Acquisition Corp. Class A Common Stock,,,,2021," 278,300,000 "
MRKR,Marker Therapeutics Inc. Common Stock,Health Care,Major Pharmaceuticals,United States,," 278,096,662 "
ZWRK,Z-Work Acquisition Corp. Class A Common Stock,,,United States,2021," 278,012,500 "
UEPS,Net 1 UEPS Technologies Inc. Common Stock,Technology,EDP Services,South Africa,2005," 277,699,220 "
FTF,Franklin Limited Duration Income Trust Common Shares of Beneficial Interest,,,United States,2003," 277,578,670 "
III,Information Services Group Inc. Information Services Group Inc. Common Stock,Technology,Retail: Computer Software & Peripheral Equipment,United States,," 277,523,296 "
UONEK,Urban One Inc. Class D Common Stock,Consumer Services,Broadcasting,United States,," 277,417,365 "
GAU,Galiano Gold Inc.,Basic Industries,Precious Metals,Canada,," 276,347,939 "
NRIM,Northrim BanCorp Inc Common Stock,Finance,Savings Institutions,United States,," 276,207,629 "
SBOW,SilverBow Resorces Inc. Common Stock,Energy,Oil & Gas Production,,," 276,128,715 "
FRSG,First Reserve Sustainable Growth Corp. Class A Common Stock,,,United States,2021," 275,180,578 "
INSE,Inspired Entertainment Inc. Common Stock,,,United States,2014," 275,137,128 "
MRLN,Marlin Business Services Corp. Common Stock,Finance,Finance Companies,United States,2003," 275,011,459 "
GGT,Gabelli Multi-Media Trust Inc. (The) Common Stock,,,United States,," 274,873,832 "
CIX,CompX International Inc. Common Stock,Miscellaneous,Diversified Manufacture,United States,1998," 273,197,489 "
GDO,Western Asset Global Corporate Defined Opportunity Fund Inc. Western Asset Global Corporate Defined Opportunity Fund Inc.,,,United States,2009," 273,074,427 "
EYPT,EyePoint Pharmaceuticals Inc. Common Stock,Health Care,Major Pharmaceuticals,United States,," 273,044,013 "
EIGR,Eiger BioPharmaceuticals Inc. Common Stock,Health Care,Biotechnology: Biological Products (No Diagnostic Substances),United States,2014," 272,968,565 "
FRBA,First Bank Common Stock,,,United States,2013," 272,593,664 "
CRBP,Corbus Pharmaceuticals Holdings Inc. Common Stock,Health Care,Major Pharmaceuticals,United States,," 272,571,953 "
AONE,one Class A Ordinary Shares,Finance,Business Services,United States,2020," 272,512,500 "
DUO,Fangdd Network Group Ltd. American Depositary Shares,Technology,Computer Software: Programming Data Processing,China,2019," 272,277,462 "
RDVT,Red Violet Inc. Common Stock ,Technology,Computer Software: Prepackaged Software,United States,," 272,256,564 "
LGI,Lazard Global Total Return and Income Fund Common Stock,,,United States,2004," 272,162,108 "
IMMR,Immersion Corporation Common Stock,Technology,Computer peripheral equipment,United States,1999," 272,101,616 "
SPRB,Spruce Biosciences Inc. Common Stock,Consumer Durables,Specialty Chemicals,United States,2020," 271,329,470 "
KZR,Kezar Life Sciences Inc. Common Stock,Health Care,Major Pharmaceuticals,United States,2018," 271,225,829 "
SIC,Select Interior Concepts Inc. Class A Common Stock,Capital Goods,Homebuilding,United States,," 271,184,251 "
RENN,Renren Inc. American Depositary Shares each representing fifteen Class A ordinary shares,Technology,EDP Services,China,2011," 271,178,529 "
DMB,BNY Mellon Municipal Bond Infrastructure Fund Inc. Common Stock,,,,2013," 271,057,442 "
AFAQ,AF Acquisition Corp. Class A Common Stock,,,United States,2021," 270,480,000 "
VEL,Velocity Financial Inc. Common Stock,Finance,Finance: Consumer Services,,2020," 270,462,546 "
BLU,BELLUS Health Inc. Common Shares,,,Canada,2019," 270,263,895 "
PIPP,Pine Island Acquisition Corp. Class A Common Stock,,,United States,2021," 270,255,150 "
ITI,Iteris Inc. Common Stock,Capital Goods,Telecommunications Equipment,United States,," 269,918,555 "
LBPS,4D pharma plc American Depositary Shares,Health Care,Major Pharmaceuticals,United Kingdom,," 269,099,183 "
ACAC,Acies Acquisition Corp. Class A Ordinary Share,Finance,Business Services,United States,2020," 269,062,500 "
PDSB,PDS Biotechnology Corporation Common Stock,Health Care,Major Pharmaceuticals,United States,2015," 268,675,828 "
EQHA,EQ Health Acquisition Corp. Class A Common Stock,,,,2021," 268,673,632 "
FUND,Sprott Focus Trust Inc. Common Stock,Finance,Investment Managers,United States,," 268,595,093 "
EBET,Esports Technologies Inc. Common Stock,Consumer Services,Services-Misc. Amusement & Recreation,United States,2021," 268,543,666 "
VIH,VPC Impact Acquisition Holdings Class A Ordinary Shares,Finance,Business Services,United States,2020," 268,028,331 "
GLHA,Glass Houses Acquisition Corp. Class A common stock,,,United States,2021," 267,687,932 "
HZN,Horizon Global Corporation Common Shares,Capital Goods,Auto Parts:O.E.M.,United States,2015," 267,641,986 "
ONCT,Oncternal Therapeutics Inc. Common Stock,Health Care,Major Pharmaceuticals,United States,," 267,577,514 "
CIDM,Cinedigm Corp. Class A Common Stock,Consumer Services,Consumer Electronics/Video Chains,United States,," 267,185,557 "
INMB,INmune Bio Inc. Common stock,Health Care,Major Pharmaceuticals,United States,2019," 267,144,894 "
SCD,LMP Capital and Income Fund Inc. Common Stock,,,United States,2004," 266,907,935 "
SJT,San Juan Basin Royalty Trust Common Stock,Energy,Oil & Gas Production,United States,," 266,136,225 "
JCE,Nuveen Core Equity Alpha Fund Nuveen Core Equity Alpha Fund Common Shares of Beneficial Interest,,,United States,2007," 266,086,065 "
PFBI,Premier Financial Bancorp Inc. Common Stock,Finance,Major Banks,United States,1996," 266,058,410 "
LVRA,Levere Holdings Corp. Class A Ordinary Shares,Finance,Business Services,Cayman Islands,2021," 265,588,328 "
VTN,Invesco Trust for Investment Grade New York Municipals Common Stock,,,United States,," 265,481,773 "
SVOKU,Seven Oaks Acquisition Corp. Unit,,,United States,2020," 265,218,750 "
MICT,MICT Inc. Common Stock,Technology,EDP Peripherals,United States,," 264,268,520 "
WTRH,Waitr Holdings Inc. Common Stock,Technology,Computer Software: Prepackaged Software,United States,2016," 264,244,829 "
KMDA,Kamada Ltd. Ordinary Shares,Health Care,Major Pharmaceuticals,Israel,2013," 263,997,648 "
ODC,Oil-Dri Corporation Of America Common Stock,Basic Industries,Industrial Specialties,United States,," 263,401,504 "
NUW,Nuveen AMT-Free Municipal Value Fund,,,United States,2009," 262,842,429 "
JOF,Japan Smaller Capitalization Fund Inc Common Stock,,,United States,1990," 262,655,188 "
ESXB,Community Bankers Trust Corporation Common Stock (VA),Finance,Major Banks,United States,," 262,313,134 "
JAGX,Jaguar Health Inc. Common Stock,Health Care,Major Pharmaceuticals,United States,2015," 262,281,739 "
XERS,Xeris Pharmaceuticals Inc. Common Stock,Health Care,Major Pharmaceuticals,United States,2018," 262,169,440 "
METC,Ramaco Resources Inc. Common Stock,Energy,Coal Mining,United States,2017," 261,488,105 "
HCAQ,HealthCor Catalio Acquisition Corp. Class A Ordinary Shares,Finance,Business Services,United States,2021," 261,446,430 "
CVCY,Central Valley Community Bancorp Common Stock,Finance,Major Banks,United States,," 261,367,644 "
REI,Ring Energy Inc. Common Stock,Energy,Oil & Gas Production,United States,," 261,095,714 "
TRCA,Twin Ridge Capital Acquisition Corp. Class A Ordinary Shares,,,,2021," 261,032,957 "
DHY,Credit Suisse High Yield Bond Fund Common Stock,,,United States,1998," 260,838,653 "
ATNF,180 Life Sciences Corp. Common Stock,Health Care,Major Pharmaceuticals,United States,2017," 260,348,000 "
GMBL,Esports Entertainment Group Inc. Common Stock,Consumer Services,Movies/Entertainment,Malta,," 259,971,136 "
AENZ,Aenza S.A.A. American Depositary Shares,Capital Goods,Engineering & Construction,,2018," 259,831,521 "
SLGL,Sol-Gel Technologies Ltd. Ordinary Shares,Basic Industries,Precious Metals,Israel,2018," 259,528,558 "
OEG,Orbital Energy Group Inc. Common Stock,,,United States,," 259,015,099 "
UBX,Unity Biotechnology Inc. Common Stock,Consumer Durables,Specialty Chemicals,United States,2018," 258,916,544 "
TISI,Team Inc. Common Stock,,,United States,," 258,579,223 "
FSII,FS Development Corp. II Class A Common Stock,,,United States,2021," 257,587,500 "
BORR,Borr Drilling Limited Common Shares,Energy,Oil & Gas Production,,2019," 256,814,406 "
NHS,Neuberger Berman High Yield Strategies Fund,,,United States,," 256,763,287 "
PCOM,Points International Ltd. Common Shares,,,Canada,," 256,685,722 "
KVHI,KVH Industries Inc. Common Stock,Technology,Radio And Television Broadcasting And Communications Equipment,United States,1996," 256,458,578 "
NRP,Natural Resource Partners LP Limited Partnership,Energy,Coal Mining,United States,2002," 256,289,600 "
CMMB,Chemomab Therapeutics Ltd. American Depositary Share,Health Care,Major Pharmaceuticals,Israel,2019," 255,896,088 "
TYME,Tyme Technologies Inc. Common Stock,Health Care,Major Pharmaceuticals,United States,," 255,640,634 "
UIHC,United Insurance Holdings Corp. Common Stock,Finance,Property-Casualty Insurers,United States,," 255,479,673 "
SCM,Stellus Capital Investment Corporation Common Stock,Finance,Finance/Investors Services,United States,2012," 255,461,499 "
ISLE,Isleworth Healthcare Acquisition Corporation Common stock,,,United States,2021," 255,364,688 "
EVF,Eaton Vance Senior Income Trust Common Stock,,,United States,1998," 255,220,931 "
NGVC,Natural Grocers by Vitamin Cottage Inc. Common Stock,Consumer Services,Food Chains,United States,2012," 254,777,171 "
GPL,Great Panther Mining Limited Ordinary Shares (Canada),Basic Industries,Precious Metals,Canada,," 254,715,022 "
OCA,Omnichannel Acquisition Corp. Class A Common Stock,,,,2021," 254,253,125 "
XGN,Exagen Inc. Common Stock,Health Care,Medical Specialities,United States,2019," 253,585,604 "
LFTR,Lefteris Acquisition Corp. Class A Common Stock,,,United States,2020," 253,178,449 "
CODX,Co-Diagnostics Inc. Common Stock,Health Care,Medical/Dental Instruments,United States,2017," 253,129,363 "
IDBA,IDEX Biometrics ASA American Depositary Shares,Miscellaneous,Diversified Manufacture,Norway,," 253,040,355 "
DWIN,Delwinds Insurance Acquisition Corp. Class A Common Stock,,,,2021," 252,987,638 "
ENVI,Environmental Impact Acquisition Corp. Class A Common Stock,,,United States,2021," 252,772,875 "
BIVI,BioVie Inc. Class A Common Stock,Health Care,Major Pharmaceuticals,United States,," 252,753,769 "
LATN,Union Acquisition Corp. II Ordinary Shares,Finance,Business Services,United States,2019," 252,500,000 "
GHAC,Gaming & Hospitality Acquisition Corp. Class A Common Stock,,,United States,2021," 252,361,725 "
VCVC,10X Capital Venture Acquisition Corp Class A Common Stock,,,United States,2021," 252,065,625 "
TLC,Taiwan Liposome Company Ltd. American Depository Shares,Health Care,Major Pharmaceuticals,Taiwan,2018," 252,044,027 "
EOD,Wells Fargo Global Dividend Opportunity Fund,,,United States,2007," 251,677,106 "
LITB,LightInTheBox Holding Co. Ltd. American Depositary Shares each representing 2 ordinary shares,Consumer Services,Catalog/Specialty Distribution,China,2013," 251,495,046 "
OXSQ,Oxford Square Capital Corp. Common Stock,Finance,Investment Bankers/Brokers/Service,United States,," 251,461,677 "
CVEO,Civeo Corporation (Canada) Common Shares,,,,2014," 251,411,513 "
LAZY,Lazydays Holdings Inc. Common Stock,Consumer Services,Other Specialty Stores,United States,," 251,292,700 "
SUNS,SLR Senior Investment Corp. Common Stock,Finance,Finance Companies,United States,," 251,167,382 "
TMTS,Spartacus Acquisition Corporation Class A Common Stock,,,United States,2020," 251,125,000 "
GTE,Gran Tierra Energy Inc. Common Stock,Energy,Oil & Gas Production,Canada,," 251,015,384 "
CRZN,Corazon Capital V838 Monoceros Corp Class A Ordinary Shares,Finance,Business Services,United States,2021," 250,927,519 "
DLCA,Deep Lake Capital Acquisition Corp. Class A Ordinary Shares,Finance,Business Services,United States,2021," 250,470,000 "
SRSA,Sarissa Capital Acquisition Corp. Class A Ordinary Shares,Finance,Business Services,United States,2020," 250,250,000 "
ID,PARTS iD Inc. Class A Common Stock,Miscellaneous,Diversified Commercial Services,United States,2017," 250,127,858 "
PZC,PIMCO California Municipal Income Fund III Common Shares of Beneficial Interest,,,United States,2002," 249,995,770 "
ZTR,Virtus Total Return Fund Inc.,,,United States,1988," 249,832,361 "
PCB,PCB Bancorp Common Stock,Finance,Major Banks,United States,2018," 249,822,102 "
VHAQ,Viveon Health Acquisition Corp. Common Stock,,,,2021," 249,801,563 "
NBN,Northeast Bank Common Stock,Finance,Major Banks,United States,," 249,759,774 "
FMAO,Farmers & Merchants Bancorp Inc. Common Stock,Finance,Savings Institutions,United States,," 249,668,436 "
BGSX,Build Acquisition Corp. Class A Common Stock,,,,2021," 249,260,000 "
CIA,Citizens Inc. Class A Common Stock ($1.00 Par),Finance,Life Insurance,United States,," 249,010,102 "
SOFIW,SoFi Technologies Inc. Warrants,,,United States,," 248,906,250 "
EMAN,eMagin Corporation Common Stock,Capital Goods,Industrial Machinery/Components,United States,," 248,611,989 "
BLCT,BlueCity Holdings Limited American Depositary Shares,Technology,EDP Services,China,2020," 247,998,254 "
BITE,Bite Acquisition Corp. Common Stock,,,,2021," 247,938,800 "
PWFL,PowerFleet Inc. Common Stock,Capital Goods,Telecommunications Equipment,United States,," 247,938,538 "
AVEO,AVEO Pharmaceuticals Inc. Common Stock,Health Care,Major Pharmaceuticals,United States,2010," 247,741,188 "
TBNK,Territorial Bancorp Inc. Common Stock,Finance,Savings Institutions,United States,2009," 247,688,886 "
CYBE,CyberOptics Corporation Common Stock,Capital Goods,Electronic Components,United States,1987," 247,521,840 "
BOCH,Bank of Commerce Holdings (CA) Common Stock,Finance,Major Banks,United States,," 247,068,139 "
TCDA,Tricida Inc. Common Stock,Health Care,Major Pharmaceuticals,United States,2018," 246,839,080 "
ETX           ,Eaton Vance Municipal Income 2028 Term Trust Common Shares of Beneficial Interest,,,,2013," 246,675,507 "
PFHD,Professional Holding Corp. Class A Common stock,Finance,Major Banks,United States,2020," 246,510,799 "
PEI,Pennsylvania Real Estate Investment Trust Common Stock,Consumer Services,Real Estate Investment Trusts,United States,," 246,498,326 "
RCHG,Recharge Acquisition Corp. Class A Common Stock,,,United States,2020," 246,241,500 "
PANA,Panacea Acquisition Corp. II Class A Ordinary Shares,Finance,Business Services,United States,2021," 245,980,350 "
ACNB,ACNB Corporation Common Stock,Finance,Major Banks,United States,," 245,937,864 "
QFTA,Quantum FinTech Acquisition Corporation Common Stock,,,,2021," 244,770,313 "
FZT,FAST Acquisition Corp. II Class A Common Stock,,,,2021," 244,750,000 "
HRTG,Heritage Insurance Holdings Inc. Common Stock,Finance,Property-Casualty Insurers,,2014," 244,695,413 "
FLC,Flaherty & Crumrine Total Return Fund Inc Common Stock,,,United States,2003," 244,553,132 "
MRCC,Monroe Capital Corporation Common Stock,Finance,Investment Managers,United States,2012," 243,925,533 "
SBT,Sterling Bancorp Inc. Common Stock,Finance,Savings Institutions,United States,2017," 243,921,500 "
TWN,Taiwan Fund Inc. (The) Common Stock,,,United States,1986," 243,858,475 "
NXR,Nuveen Select Tax Free Income Portfolio III Common Stock,,,United States,1992," 243,583,177 "
NRO,Neuberger Berman Real Estate Securities Income Fund Inc. Neuberger Berman Real Estate Securities Income Fund Inc.,,,United States,2003," 243,266,657 "
GCBC,Greene County Bancorp Inc. Common Stock,Finance,Banks,United States,," 243,057,970 "
TCAC,Tuatara Capital Acquisition Corporation Class A Ordinary Shares,Finance,Business Services,United States,2021," 243,000,000 "
PKBK,Parke Bancorp Inc. Common Stock,Finance,Major Banks,United States,," 242,920,116 "
IDE,Voya Infrastructure Industrials and Materials Fund Common Shares of Beneficial Interest,,,United States,2010," 242,750,935 "
CHMA,Chiasma Inc. Common Stock,Health Care,Major Pharmaceuticals,United States,2015," 242,619,511 "
FVCB,FVCBankcorp Inc. Common Stock,Finance,Commercial Banks,United States,," 242,363,857 "
TLSA,Tiziana Life Sciences plc American Depository Share,Health Care,Major Pharmaceuticals,United Kingdom,2018," 242,292,299 "
GLDG,GoldMining Inc. Common Shares,Basic Industries,Precious Metals,,," 242,208,436 "
FLNT,Fluent Inc. Common Stock,Consumer Services,EDP Services,United States,," 241,676,322 "
TSBK,Timberland Bancorp Inc. Common Stock,Finance,Banks,United States,," 240,851,722 "
CLIM,Climate Real Impact Solutions II Acquisition Corporation Class A Common Stock,,,,2021," 240,775,500 "
JTD,Nuveen Tax-Advantaged Dividend Growth Fund Common Shares of Beneficial Interest,,,United States,," 240,729,731 "
SJ,Scienjoy Holding Corporation Ordinary Shares,Technology,EDP Services,China,2019," 240,579,493 "
FDEU,First Trust Dynamic Europe Equity Income Fund Common Shares of Beneficial Interest,,,,2015," 240,557,436 "
FRBK,Republic First Bancorp Inc. Common Stock,Finance,Major Banks,United States,," 240,202,974 "
AFT,Apollo Senior Floating Rate Fund Inc. Common Stock,,,,2011," 239,980,870 "
NEPT,Neptune Wellness Solutions Inc. Ordinary Shares,,,Canada,," 239,964,166 "
MOXC,Moxian Inc. Common Stock,Technology,Computer Software: Programming Data Processing,China,," 239,634,629 "
WMC,Western Asset Mortgage Capital Corporation Common Stock,Consumer Services,Real Estate Investment Trusts,United States,2012," 239,602,042 "
ALCO,Alico Inc. Common Stock,Consumer Non-Durables,Farming/Seeds/Milling,United States,," 239,391,457 "
CPLP,Capital Product Partners L.P. Common Units,Transportation,Marine Transportation,Greece,2007," 239,229,444 "
FIF,First Trust Energy Infrastructure Fund Common Shares of Beneficial Interest,,,United States,2011," 239,086,702 "
TKAT,Takung Art Co. Ltd. Common Stock,Consumer Services,Catalog/Specialty Distribution,,," 239,078,770 "
EHI,Western Asset Global High Income Fund Inc Common Stock,,,United States,2003," 239,002,537 "
EVG,Eaton Vance Short Diversified Income Fund Eaton Vance Short Duration Diversified Income Fund Common Shares of Beneficial Interest,Finance,Investment Managers,United States,2005," 238,884,763 "
PDLB,PDL Community Bancorp Common Stock,,,United States,2017," 238,779,041 "
APTX,Aptinyx Inc. Common Stock,Health Care,Major Pharmaceuticals,United States,2018," 238,608,076 "
CKPT,Checkpoint Therapeutics Inc. Common Stock,Health Care,Major Pharmaceuticals,United States,," 238,343,304 "
ISTR,Investar Holding Corporation Common Stock,Finance,Commercial Banks,United States,2014," 238,048,747 "
CASI,CASI Pharmaceuticals Inc. Common Stock,Health Care,Biotechnology: Biological Products (No Diagnostic Substances),United States,," 237,655,728 "
XIN,Xinyuan Real Estate Co Ltd American Depositary Shares,Capital Goods,Homebuilding,China,2007," 237,481,727 "
OBSV,ObsEva SA Ordinary Shares,Health Care,Major Pharmaceuticals,Switzerland,2017," 237,358,021 "
BCBP,BCB Bancorp Inc. (NJ) Common Stock,Finance,Savings Institutions,United States,2005," 236,959,055 "
NETI,Eneti Inc. Common Stock,Transportation,Marine Transportation,Monaco,2013," 236,916,708 "
JCO,Nuveen Credit Opportunities 2022 Target Term Fund Common Shares of Beneficial Interest,,,United States,2017," 236,434,192 "
NEN,New England Realty Associates Limited Partnership Class A Depositary Receipts Evidencing Units of Limited Partnership,Consumer Services,Building operators,United States,," 236,201,587 "
AAOI,Applied Optoelectronics Inc. Common Stock,Technology,Semiconductors,United States,2013," 236,117,754 "
MFIN,Medallion Financial Corp. Common Stock,Finance,Diversified Financial Services,United States,," 235,565,103 "
UNTY,Unity Bancorp Inc. Common Stock,Finance,Major Banks,United States,," 235,328,727 "
CTIC,CTI BioPharma Corp. (DE) Common Stock,Health Care,Major Pharmaceuticals,United States,1997," 235,071,174 "
IHIT,Invesco High Income 2023 Target Term Fund Common Shares of Beneficial Interest,,,United States,2016," 235,045,214 "
BCTG,BCTG Acquisition Corp. Common Stock,,,United States,2020," 235,042,864 "
FTFT,Future FinTech Group Inc. Common Stock,Technology,EDP Services,China,," 234,686,548 "
MXF,Mexico Fund Inc. (The) Common Stock,,,United States,," 234,381,599 "
ENX,Eaton Vance New York Municipal Bond Fund Common Shares of Beneficial Interest $.01 par value,,,United States,2002," 234,269,541 "
FBIZ,First Business Financial Services Inc. Common Stock,Finance,Major Banks,United States,," 234,103,851 "
VINC,Vincerx Pharma Inc. Common Stock,Health Care,Biotechnology: Biological Products (No Diagnostic Substances),United States,2020," 233,555,930 "
ADMA,ADMA Biologics Inc Common Stock,Health Care,Major Pharmaceuticals,United States,," 233,305,123 "
SAMG,Silvercrest Asset Management Group Inc. Class A Common Stock,Finance,Investment Managers,United States,2013," 233,206,989 "
GRX,The Gabelli Healthcare & Wellness Trust Common Shares of Beneficial Interest,,,United States,," 233,102,708 "
IGI,Western Asset Investment Grade Defined Opportunity Trust Inc. Common Stock,,,United States,2009," 232,788,904 "
AQMS,Aqua Metals Inc. Common Stock,Public Utilities,Environmental Services,United States,2015," 232,706,516 "
ZYNE,Zynerba Pharmaceuticals Inc. Common Stock,Health Care,Major Pharmaceuticals,United States,2015," 232,658,669 "
ONE,OneSmart International Education Group Limited ADS,Miscellaneous,Service to the Health Industry,,2018," 232,617,033 "
SD,SandRidge Energy Inc. Common Stock,Energy,Oil & Gas Production,,2016," 232,548,998 "
KF,Korea Fund Inc. (The) New Common Stock,,,United States,," 232,424,889 "
HURC,Hurco Companies Inc. Common Stock,Basic Industries,Steel/Iron Ore,United States,," 232,303,477 "
KULR,KULR Technology Group Inc. Common Stock,Capital Goods,Electrical Products,United States,," 231,848,112 "
NGC,Northern Genesis Acquisition Corp. III Common Stock,,,,2021," 231,770,000 "
GAIA,Gaia Inc. Class A Common Stock,Capital Goods,Industrial Machinery/Components,United States,1999," 231,409,161 "
ISAA,Iron Spark I Inc. Class A Common Stock,,,United States,2021," 231,150,000 "
ADMS,Adamas Pharmaceuticals Inc. Common Stock,Health Care,Major Pharmaceuticals,United States,2014," 231,127,204 "
VBF,Invesco Bond Fund Common Stock,,,United States,," 231,050,772 "
NVVE,Nuvve Holding Corp. Common Stock,Energy,Oil Refining/Marketing,China,2020," 230,970,770 "
SCPE,SC Health Corporation Class A Ordinary Shares,Finance,Business Services,,2019," 230,862,500 "
DHF,BNY Mellon High Yield Strategies Fund Common Stock,,,United States,1998," 230,483,371 "
USAS,Americas Gold and Silver Corporation Common Shares no par value,Basic Industries,Precious Metals,,2017," 230,248,210 "
TSQ,Townsquare Media Inc. Class A Common Stock,Technology,Advertising,United States,2014," 230,199,265 "
ACET,Adicet Bio Inc. Common Stock ,Health Care,Major Pharmaceuticals,United States,2018," 230,180,479 "
GRTX,Galera Therapeutics Inc. Common Stock,Consumer Durables,Specialty Chemicals,United States,2019," 230,065,143 "
IMPL,Impel NeuroPharma Inc. Common Stock,Health Care,Major Pharmaceuticals,United States,2021," 229,891,117 "
ATLO,Ames National Corporation Common Stock,Finance,Major Banks,United States,," 229,163,405 "
IRS,IRSA Inversiones Y Representaciones S.A. Common Stock,Consumer Services,Homebuilding,Argentina,," 228,022,236 "
IVH,Ivy High Income Opportunities Fund Common Shares of Beneficial Interest,,,,2013," 227,840,731 "
SMTI,Sanara MedTech Inc. Common Stock,Health Care,Industrial Specialties,United States,," 227,718,280 "
HROW,Harrow Health Inc. Common Stock,Health Care,Major Pharmaceuticals,United States,," 227,543,760 "
BWFG,Bankwell Financial Group Inc. Common Stock,Finance,Major Banks,United States,2014," 226,977,681 "
SRRA,Sierra Oncology Inc. Common Stock,Health Care,Major Pharmaceuticals,Canada,2015," 226,868,784 "
SUP,Superior Industries International Inc. Common Stock (DE),Capital Goods,Auto Parts:O.E.M.,United States,," 226,780,818 "
