INOV,Inovalon Holdings Inc. Class A Common Stock,Technology,EDP Services,United States,2015," 5,113,298,403 "
SHLS,Shoals Technologies Group Inc. Class A Common Stock,Technology,Semiconductors,United States,2021," 5,104,996,919 "
API,Agora Inc. American Depositary Shares,Technology,Computer Software: Prepackaged Software,China,2020," 5,098,308,160 "
ATC,Atotech Limited Common Shares,Basic Industries,Major Chemicals,,2021," 5,098,254,246 "
IDA,IDACORP Inc. Common Stock,Public Utilities,Electric Utilities: Central,United States,," 5,096,506,575 "
PK,Park Hotels & Resorts Inc. Common Stock ,Consumer Services,Real Estate Investment Trusts,United States,2016," 5,094,005,628 "
LESL,Leslie's Inc. Common Stock,Consumer Services,,United States,2020," 5,088,832,276 "
NEO,NeoGenomics Inc. Common Stock,Health Care,Precision Instruments,United States,," 5,082,641,158 "
UBSI,United Bankshares Inc. Common Stock,Finance,Major Banks,United States,," 5,082,211,110 "
BPMC,Blueprint Medicines Corporation Common Stock,Health Care,Major Pharmaceuticals,United States,2015," 5,069,878,696 "
DQ,DAQO New Energy Corp. American Depositary Shares each representing five ordinary shares,Technology,Semiconductors,China,2010," 5,049,647,810 "
HIW,Highwoods Properties Inc. Common Stock,Consumer Services,Real Estate Investment Trusts,United States,1994," 5,047,743,753 "
RYN,Rayonier Inc. REIT Common Stock,Consumer Services,Real Estate Investment Trusts,United States,," 5,046,786,858 "
ROLL,RBC Bearings Incorporated Common Stock,Capital Goods,Metal Fabrications,United States,2005," 5,036,129,620 "
WK,Workiva Inc. Class A Common Stock,Technology,Computer Software: Prepackaged Software,United States,2014," 5,034,886,173 "
MSTR,MicroStrategy Incorporated Common Stock Class A,Technology,Computer Software: Prepackaged Software,United States,1998," 5,033,014,049 "
NFG,National Fuel Gas Company Common Stock,Energy,Oil & Gas Production,United States,," 5,030,909,641 "
ALLK,Allakos Inc. Common Stock,Health Care,Major Pharmaceuticals,United States,2018," 5,030,732,405 "
STN,Stantec Inc Common Stock,Transportation,Marine Transportation,Canada,," 5,030,329,693 "
AM,Antero Midstream Corporation Common Stock,Public Utilities,Natural Gas Distribution,United States,2017," 5,021,804,898 "
THG,Hanover Insurance Group Inc,Finance,Property-Casualty Insurers,United States,," 5,019,456,256 "
VMI,Valmont Industries Inc. Common Stock,Capital Goods,Diversified Manufacture,United States,," 5,014,829,844 "
STL,Sterling Bancorp,Finance,Major Banks,United States,," 5,011,433,682 "
APLS,Apellis Pharmaceuticals Inc. Common Stock,Health Care,Major Pharmaceuticals,United States,2017," 5,000,459,415 "
JOBS,51job Inc. American Depositary Shares,Technology,Diversified Commercial Services,China,2004," 4,994,083,092 "
DRVN,Driven Brands Holdings Inc. Common Stock,,,United States,2021," 4,993,895,187 "
INSP,Inspire Medical Systems Inc. Common Stock,Health Care,Biotechnology: Electromedical & Electrotherapeutic Apparatus,United States,1998," 4,982,796,977 "
SYNA,Synaptics Incorporated Common Stock $0.001 Par Value,Technology,Computer peripheral equipment,United States,2002," 4,971,217,967 "
APPF,AppFolio Inc. Class A Common Stock,Technology,EDP Services,United States,2015," 4,943,147,386 "
BXMT,Blackstone Mortgage Trust Inc. Common Stock,Consumer Services,Real Estate Investment Trusts,United States,," 4,941,710,129 "
AUY,Yamana Gold Inc. Ordinary Shares (Canada),Basic Industries,Precious Metals,Canada,," 4,933,950,786 "
ALTR,Altair Engineering Inc. Class A Common Stock,Technology,Computer Software: Prepackaged Software,United States,2017," 4,921,033,666 "
MTG,MGIC Investment Corporation Common Stock,Finance,Property-Casualty Insurers,United States,1991," 4,916,683,435 "
LAZ,Lazard LTD. Lazard LTD. Class A Common Stock,Finance,Investment Managers,Bermuda,2005," 4,910,829,367 "
RPD,Rapid7 Inc. Common Stock,Technology,Computer Software: Prepackaged Software,United States,2015," 4,899,951,023 "
POWI,Power Integrations Inc. Common Stock,Technology,Semiconductors,United States,1997," 4,896,086,695 "
HE,Hawaiian Electric Industries Inc. Common Stock,,,United States,," 4,895,698,146 "
QDEL,Quidel Corporation Common Stock,Health Care,Biotechnology: In Vitro & In Vivo Diagnostic Substances,United States,," 4,883,557,152 "
OCFT,OneConnect Financial Technology Co. Ltd. American Depositary Shares each representing three ordinary shares,Technology,Computer Software: Programming Data Processing,China,2019," 4,882,719,284 "
TNET,TriNet Group Inc. Common Stock,Technology,Diversified Commercial Services,,2014," 4,870,630,385 "
XRX,Xerox Holdings Corporation Common Stock,Technology,EDP Services,United States,," 4,850,509,358 "
HL,Hecla Mining Company Common Stock,Basic Industries,Precious Metals,United States,," 4,841,384,891 "
FCN,FTI Consulting Inc. Common Stock,Consumer Services,Professional Services,United States,," 4,824,857,280 "
SSD,Simpson Manufacturing Company Inc. Common Stock,Capital Goods,Industrial Specialties,United States,," 4,824,723,795 "
WTS,Watts Water Technologies Inc. Class A Common Stock,Capital Goods,Office Equipment/Supplies/Services,United States,1986," 4,807,648,753 "
HLNE,Hamilton Lane Incorporated Class A Common Stock,Finance,Investment Managers,United States,2017," 4,803,460,027 "
TTEC,TTEC Holdings Inc. Common Stock,Technology,Retail: Computer Software & Peripheral Equipment,United States,1996," 4,800,266,382 "
NOVT,Novanta Inc. Common Stock,,,United States,," 4,777,233,803 "
WWE,World Wrestling Entertainment Inc. Class A Common Stock,Consumer Services,Movies/Entertainment,United States,," 4,776,351,714 "
HRB,H&R Block Inc. Common Stock,Miscellaneous,Other Consumer Services,United States,," 4,751,685,014 "
PDCE,PDC Energy Inc. Common Stock (Delaware),Energy,Oil & Gas Production,United States,," 4,750,266,296 "
CDNA,CareDx Inc. Common Stock,Health Care,Medical Specialities,United States,2014," 4,749,923,485 "
EVBG,Everbridge Inc. Common Stock,Technology,Retail: Computer Software & Peripheral Equipment,United States,2016," 4,745,120,898 "
ONEM,1Life Healthcare Inc. Common Stock,Technology,Computer Software: Prepackaged Software,United States,2020," 4,718,136,353 "
RLI,RLI Corp. Common Stock (DE),Finance,Property-Casualty Insurers,United States,," 4,708,842,136 "
SLGN,Silgan Holdings Inc. Common Stock,Consumer Durables,Containers/Packaging,United States,1997," 4,699,700,798 "
KMPR,Kemper Corporation,Finance,Property-Casualty Insurers,United States,," 4,683,008,680 "
CELH,Celsius Holdings Inc. Common Stock,Consumer Non-Durables,Beverages (Production/Distribution),United States,," 4,679,171,667 "
UNVR,Univar Solutions Inc. Common Stock,Basic Industries,Specialty Chemicals,United States,2015," 4,673,820,696 "
AVNT,Avient Corporation Common Stock,Basic Industries,Major Chemicals,United States,," 4,671,685,809 "
EXPO,Exponent Inc. Common Stock,Consumer Services,Professional Services,United States,," 4,657,700,467 "
ACIW,ACI Worldwide Inc. Common Stock,Technology,EDP Services,United States,," 4,647,414,417 "
BRFS,BRF S.A.,Consumer Non-Durables,Meat/Poultry/Fish,Brazil,," 4,647,346,967 "
ENSG,The Ensign Group Inc. Common Stock,Health Care,Hospital/Nursing Management,United States,2007," 4,636,250,298 "
SIGI,Selective Insurance Group Inc. Common Stock,Finance,Property-Casualty Insurers,United States,," 4,628,470,226 "
TRNO,Terreno Realty Corporation Common Stock,Consumer Services,Real Estate Investment Trusts,United States,2010," 4,627,311,802 "
ADNT,Adient plc Ordinary Shares ,Capital Goods,Auto Parts:O.E.M.,,2016," 4,626,569,859 "
SAGE,Sage Therapeutics Inc. Common Stock,Health Care,Major Pharmaceuticals,United States,2014," 4,626,354,224 "
CRI,Carter's Inc. Common Stock,Consumer Services,Clothing/Shoe/Accessory Stores,United States,2003," 4,622,505,185 "
NEA,Nuveen AMT-Free Quality Municipal Income Fund Common Shares of Beneficial Interest Par Value $.01,,,United States,2002," 4,620,127,706 "
AMRS,Amyris Inc. Common Stock,Basic Industries,Industrial Specialties,United States,2010," 4,619,816,222 "
CLDR,Cloudera Inc. Common Stock,Technology,Computer Software: Prepackaged Software,Canada,2017," 4,616,990,238 "
AB,AllianceBernstein Holding L.P.  Units,Finance,Investment Managers,United States,," 4,612,484,069 "
WTFC,Wintrust Financial Corporation Common Stock,Finance,Major Banks,United States,," 4,607,664,866 "
FIZZ,National Beverage Corp. Common Stock,Consumer Non-Durables,Beverages (Production/Distribution),United States,," 4,604,411,555 "
ALSN,Allison Transmission Holdings Inc. Common Stock,Capital Goods,Auto Parts:O.E.M.,United States,2012," 4,600,882,272 "
JBGS,JBG SMITH Properties Common Shares ,Consumer Services,Real Estate Investment Trusts,United States,2017," 4,597,210,249 "
SABR,Sabre Corporation Common Stock,Technology,EDP Services,United States,2014," 4,597,079,751 "
ADC,Agree Realty Corporation Common Stock,Consumer Services,Real Estate Investment Trusts,United States,," 4,590,259,708 "
TENB,Tenable Holdings Inc. Common Stock,Technology,EDP Services,United States,2018," 4,590,045,030 "
UFPI,UFP Industries Inc. Common Stock,Basic Industries,Forest Products,United States,1993," 4,589,016,978 "
IIPR,Innovative Industrial Properties Inc. Common Stock,Consumer Services,Real Estate Investment Trusts,United States,2016," 4,587,392,758 "
GOOS,Canada Goose Holdings Inc. Subordinate Voting Shares,,,,2017," 4,578,807,366 "
CRUS,Cirrus Logic Inc. Common Stock,Technology,Semiconductors,United States,1989," 4,573,843,838 "
PSTH,Pershing Square Tontine Holdings Ltd. Class A Common Stock,,,,2020," 4,572,002,286 "
FTI,TechnipFMC plc Ordinary Share,Energy,Metal Fabrications,,," 4,565,269,808 "
GRA,W.R. Grace & Co. Common Stock,Basic Industries,Major Chemicals,United States,," 4,558,913,312 "
HR,Healthcare Realty Trust Incorporated Common Stock,Consumer Services,Real Estate Investment Trusts,United States,1993," 4,554,371,476 "
HCM,HUTCHMED (China) Limited American Depositary Shares,Health Care,Major Pharmaceuticals,Hong Kong,2016," 4,548,990,683 "
UMBF,UMB Financial Corporation Common Stock,Finance,Commercial Banks,United States,," 4,545,279,961 "
NARI,Inari Medical Inc. Common Stock,Health Care,Biotechnology: Electromedical & Electrotherapeutic Apparatus,United States,2020," 4,538,858,293 "
AMN,AMN Healthcare Services Inc AMN Healthcare Services Inc,Health Care,Assisted Living Services,United States,," 4,523,921,800 "
APG,APi Group Corporation Common Stock,Consumer Services,Military/Government/Technical,,2020," 4,498,657,773 "
AG,First Majestic Silver Corp. Ordinary Shares (Canada),Basic Industries,Precious Metals,Canada,," 4,496,936,095 "
HPP,Hudson Pacific Properties Inc. Common Stock,Consumer Services,Real Estate Investment Trusts,United States,2010," 4,486,277,243 "
CCMP,CMC Materials Inc. Common Stock,Technology,Semiconductors,United States,2000," 4,474,373,757 "
SPWR,SunPower Corporation Common Stock,Technology,Semiconductors,United States,2005," 4,468,297,733 "
POR,Portland General Electric Co Common Stock,Public Utilities,Electric Utilities: Central,United States,," 4,466,847,036 "
REZI,Resideo Technologies Inc. Common Stock ,Miscellaneous,Diversified Manufacture,,2018," 4,462,239,191 "
ITRI,Itron Inc. Common Stock,Capital Goods,Electrical Products,United States,1993," 4,455,040,131 "
JBT,John Bean Technologies Corporation Common Stock,Capital Goods,Diversified Manufacture,United States,," 4,454,572,001 "
RHP,Ryman Hospitality Properties Inc. (REIT),Consumer Services,Real Estate Investment Trusts,United States,," 4,454,197,253 "
WING,Wingstop Inc. Common Stock,Consumer Services,Restaurants,United States,2015," 4,446,252,018 "
FTDR,frontdoor inc. Common Stock,Miscellaneous,Other Consumer Services,United States,," 4,441,058,318 "
NAV,Navistar International Corporation Common Stock,Capital Goods,Auto Manufacturing,United States,," 4,431,660,886 "
SANA,Sana Biotechnology Inc. Common Stock,Consumer Durables,Specialty Chemicals,United States,2021," 4,421,638,267 "
CRNC,Cerence Inc. Common Stock,Technology,EDP Services,United States,," 4,420,502,234 "
ZY,Zymergen Inc. Common Stock,Health Care,Biotechnology: Commercial Physical & Biological Resarch,United States,2021," 4,420,309,278 "
AR,Antero Resources Corporation Common Stock,Energy,Oil & Gas Production,,2013," 4,420,196,211 "
ALHC,Alignment Healthcare Inc. Common Stock,Health Care,Medical Specialities,United States,2021," 4,419,661,255 "
FROG,JFrog Ltd. Ordinary Shares,Technology,Computer Software: Prepackaged Software,United States,2020," 4,418,680,754 "
LPRO,Open Lending Corporation Class A Common Stock,Finance,Finance: Consumer Services,United States,," 4,416,670,025 "
COMM,CommScope Holding Company Inc. Common Stock,Technology,Radio And Television Broadcasting And Communications Equipment,United States,2013," 4,412,180,651 "
DOCN,DigitalOcean Holdings Inc. Common Stock,Technology,Retail: Computer Software & Peripheral Equipment,,2021," 4,408,530,547 "
AXS,Axis Capital Holdings Limited Common Stock,Finance,Property-Casualty Insurers,Bermuda,2003," 4,406,681,186 "
RDN,Radian Group Inc. Common Stock,Finance,Property-Casualty Insurers,United States,," 4,404,107,142 "
BE,Bloom Energy Corporation Class A Common Stock,Consumer Durables,Electrical Products,,2018," 4,402,836,999 "
SONO,Sonos Inc. Common Stock,Consumer Services,Consumer Electronics/Video Chains,United States,2018," 4,402,041,829 "
ASAI,Sendas Distribuidora S.A. ADS,Consumer Services,Food Chains,,2021," 4,398,282,183 "
TIGO,Millicom International Cellular S.A. Common Stock,Public Utilities,Telecommunications Equipment,Luxembourg,," 4,397,168,959 "
PSB,PS Business Parks Inc. (MD) Common Stock,Consumer Services,Real Estate Investment Trusts,United States,," 4,393,629,517 "
ACAD,ACADIA Pharmaceuticals Inc. Common Stock,Health Care,Major Pharmaceuticals,United States,2004," 4,392,109,167 "
SEAS,SeaWorld Entertainment Inc. Common Stock,Consumer Services,Movies/Entertainment,United States,2013," 4,391,904,210 "
HOMB,Home BancShares Inc. Common Stock,Finance,Major Banks,United States,2006," 4,388,104,289 "
BKH,Black Hills Corporation Common Stock,Public Utilities,Electric Utilities: Central,United States,," 4,380,273,220 "
SEB,Seaboard Corporation Common Stock,,,United States,1996," 4,377,286,001 "
AVT,Avnet Inc. Common Stock,Technology,Electronic Components,United States,," 4,370,129,992 "
CIG,Comp En De Mn Cemig ADS American Depositary Shares,Public Utilities,Electric Utilities: Central,Brazil,," 4,367,194,821 "
ICUI,ICU Medical Inc. Common Stock,Health Care,Medical/Dental Instruments,United States,1992," 4,347,723,719 "
LOPE,Grand Canyon Education Inc. Common Stock,Miscellaneous,Service to the Health Industry,United States,2008," 4,335,557,069 "
RXT,Rackspace Technology Inc. Common Stock,Technology,EDP Services,United States,2020," 4,332,794,950 "
KBH,KB Home Common Stock,,,United States,1986," 4,327,698,213 "
NEWR,New Relic Inc. Common Stock,Technology,Computer Software: Prepackaged Software,United States,2014," 4,324,609,631 "
UNF,Unifirst Corporation Common Stock,Miscellaneous,Business Services,United States,," 4,324,233,057 "
TKC,Turkcell Iletisim Hizmetleri AS Common Stock,Public Utilities,Telecommunications Equipment,Turkey,," 4,322,550,261 "
PPBI,Pacific Premier Bancorp Inc,Finance,Major Banks,United States,," 4,319,866,848 "
UGP,Ultrapar Participacoes S.A. (New) American Depositary Shares (Each representing one Common Share),Energy,Oil Refining/Marketing,Brazil,," 4,319,804,303 "
WRI,Weingarten Realty Investors Common Stock,Consumer Services,Real Estate Investment Trusts,United States,," 4,315,061,128 "
MSP,Datto Holding Corp. Common Stock,Technology,Computer Software: Prepackaged Software,United States,2020," 4,314,125,590 "
ENV,Envestnet Inc Common Stock,Technology,EDP Services,United States,2010," 4,312,448,567 "
KWR,Quaker Chemical Corporation Common Stock,Basic Industries,Automotive Aftermarket,United States,," 4,308,008,971 "
LDI,loanDepot Inc. Class A Common Stock,Finance,Finance: Consumer Services,,2021," 4,306,861,539 "
BKU,BankUnited Inc. Common Stock,Finance,Savings Institutions,United States,2011," 4,305,953,012 "
SMTC,Semtech Corporation Common Stock,Technology,Semiconductors,United States,," 4,304,615,745 "
SAIL,SailPoint Technologies Holdings Inc. Common Stock,Technology,Computer Software: Prepackaged Software,United States,2017," 4,300,082,800 "
KOD,Kodiak Sciences Inc Common Stock,Health Care,Major Pharmaceuticals,United States,2018," 4,286,778,547 "
BCPC,Balchem Corporation Common Stock,Basic Industries,Industrial Specialties,United States,," 4,286,052,341 "
AIMC,Altra Industrial Motion Corp. Common Stock,Capital Goods,Industrial Machinery/Components,United States,2006," 4,278,768,714 "
R,Ryder System Inc. Common Stock,Miscellaneous,Rental/Leasing Companies,United States,," 4,278,386,136 "
MSGS,Madison Square Garden Sports Corp. Class A Common Stock (New),Consumer Services,Hotels/Resorts,United States,2015," 4,272,502,171 "
BIGC,BigCommerce Holdings Inc. Series 1 Common Stock,Technology,Computer Software: Prepackaged Software,United States,2020," 4,264,147,474 "
OLK,Olink Holding AB (publ) American Depositary Shares,Capital Goods,Biotechnology: Laboratory Analytical Instruments,Sweden,2021," 4,260,452,820 "
APAM,Artisan Partners Asset Management Inc. Class A Common Stock,Finance,Investment Managers,United States,2013," 4,258,159,051 "
NJR,NewJersey Resources Corporation Common Stock,Public Utilities,Oil/Gas Transmission,United States,," 4,253,404,333 "
CBU,Community Bank System Inc. Common Stock,Finance,Major Banks,United States,," 4,246,539,642 "
HASI,Hannon Armstrong Sustainable Infrastructure Capital Inc. Common Stock,Consumer Services,Real Estate Investment Trusts,United States,2013," 4,234,012,673 "
MGNI,Magnite Inc. Common Stock,Technology,Advertising,United States,," 4,233,019,727 "
ENBL,Enable Midstream Partners LP Common Units representing limited partner interests,,,,2014," 4,227,901,548 "
TGNA,TEGNA Inc,Consumer Services,Broadcasting,United States,," 4,227,805,823 "
PNM,PNM Resources Inc. (Holding Co.) Common Stock,Public Utilities,Electric Utilities: Central,United States,," 4,221,359,103 "
PRVA,Privia Health Group Inc. Common Stock,Health Care,Medical/Nursing Services,United States,2021," 4,219,577,261 "
RCII,Rent-A-Center Inc. Common Stock,Technology,Diversified Commercial Services,United States,1995," 4,216,611,439 "
SHAK,Shake Shack Inc. Class A Common Stock,Consumer Services,Restaurants,United States,2015," 4,215,127,761 "
DOC,Physicians Realty Trust Common Shares of Beneficial Interest,Consumer Services,Real Estate Investment Trusts,United States,2013," 4,195,189,510 "
ABCM,Abcam plc American Depositary Shares,Health Care,Biotechnology: Biological Products (No Diagnostic Substances),United Kingdom,2020," 4,188,030,370 "
FUBO,fuboTV Inc. Common Stock,Consumer Services,Broadcasting,,2020," 4,184,477,046 "
STEM,Stem Inc. Class A Common Stock,Technology,Computer Software: Prepackaged Software,United States,2020," 4,182,595,003 "
SPT,Sprout Social Inc Class A Common Stock,Technology,EDP Services,United States,2019," 4,181,796,791 "
ARNC,Arconic Corporation Common Stock ,,,,2020," 4,181,215,164 "
VZIO,VIZIO Holding Corp. Class A Common Stock,Consumer Non-Durables,Consumer Electronics/Appliances,,2021," 4,177,893,159 "
UMPQ,Umpqua Holdings Corporation Common Stock,Finance,Commercial Banks,United States,," 4,165,365,129 "
ENIC,Enel Chile S.A. American Depositary Shares (Each representing 50 shares of Common Stock),Public Utilities,Electric Utilities: Central,,2016," 4,163,826,743 "
FNB,F.N.B. Corporation Common Stock,Finance,Major Banks,United States,," 4,161,591,006 "
HAIN,Hain Celestial Group Inc. (The) Common Stock,Capital Goods,Office Equipment/Supplies/Services,United States,," 4,152,352,251 "
PFSI,PennyMac Financial Services Inc. Common Stock,Finance,Finance: Consumer Services,United States,2013," 4,149,532,432 "
PINC,Premier Inc. Class A Common Stock,Health Care,Managed Health Care,United States,2013," 4,147,381,135 "
RVLV,Revolve Group Inc. Class A Common Stock,Consumer Services,Catalog/Specialty Distribution,,2019," 4,144,647,762 "
ETRN,Equitrans Midstream Corporation Common Stock ,Energy,Oilfield Services/Equipment,,2018," 4,134,680,880 "
AY,Atlantica Sustainable Infrastructure plc Ordinary Shares,Public Utilities,Electric Utilities: Central,United Kingdom,2014," 4,133,863,605 "
OGS,ONE Gas Inc. Common Stock,Public Utilities,Oil/Gas Transmission,,2014," 4,127,563,563 "
HWC,Hancock Whitney Corporation Common Stock,Finance,Major Banks,United States,," 4,118,683,583 "
CERT,Certara Inc. Common Stock,Consumer Durables,Specialty Chemicals,United States,2020," 4,118,207,575 "
MTSI,MACOM Technology Solutions Holdings Inc. Common Stock,Technology,Semiconductors,United States,2012," 4,113,295,622 "
ALRM,Alarm.com Holdings Inc. Common Stock,Technology,Computer Software: Prepackaged Software,United States,2015," 4,110,029,715 "
SAFE,Safehold Inc. Common Stock,Consumer Services,Real Estate Investment Trusts,United States,2017," 4,099,639,255 "
CWK,Cushman & Wakefield plc Ordinary Shares,Finance,Real Estate,,2018," 4,099,313,649 "
SUM,Summit Materials Inc. Class A Common Stock,Capital Goods,Building Materials,United States,2015," 4,078,347,223 "
LPSN,LivePerson Inc. Common Stock,Technology,EDP Services,United States,2000," 4,071,709,135 "
BOX,Box Inc. Class A Common Stock,Technology,Computer Software: Prepackaged Software,United States,2015," 4,069,731,550 "
ENS,EnerSys Common Stock,Consumer Non-Durables,Telecommunications Equipment,United States,2004," 4,064,745,317 "
SNDR,Schneider National Inc. Common Stock,Transportation,Trucking Freight/Courier Services,United States,2017," 4,059,116,309 "
PSN,Parsons Corporation Common Stock,Capital Goods,Industrial Machinery/Components,,2019," 4,054,356,791 "
COKE,Coca-Cola Consolidated Inc. Common Stock,Consumer Non-Durables,Beverages (Production/Distribution),United States,1972," 4,051,589,596 "
ANAT,American National Group Inc. Common Stock,Finance,Life Insurance,United States,," 4,047,061,344 "
VICR,Vicor Corporation Common Stock,Capital Goods,Industrial Machinery/Components,United States,," 4,046,538,879 "
VIAV,Viavi Solutions Inc. Common Stock,Technology,Radio And Television Broadcasting And Communications Equipment,United States,," 4,035,476,108 "
SWTX,SpringWorks Therapeutics Inc. Common Stock,Health Care,Major Pharmaceuticals,United States,2019," 4,033,805,698 "
QLYS,Qualys Inc. Common Stock,Technology,EDP Services,United States,2012," 4,026,525,916 "
KEX,Kirby Corporation Common Stock,Transportation,Marine Transportation,United States,," 4,019,822,400 "
EPR,EPR Properties Common Stock,Consumer Services,Real Estate Investment Trusts,United States,1997," 4,017,310,377 "
TIGR,UP Fintech Holding Ltd American Depositary Share representing fifteen Class A Ordinary Shares,Finance,Investment Bankers/Brokers/Service,China,2019," 4,016,429,271 "
AEIS,Advanced Energy Industries Inc. Common Stock,Consumer Durables,Electrical Products,United States,1995," 4,016,344,393 "
ALKS,Alkermes plc Ordinary Shares,Health Care,Major Pharmaceuticals,Ireland,1991," 4,016,112,283 "
HGV,Hilton Grand Vacations Inc. Common Stock ,Consumer Services,Hotels/Resorts,,2016," 4,005,084,961 "
KRTX,Karuna Therapeutics Inc. Common Stock,Health Care,Major Pharmaceuticals,United States,2019," 4,004,800,961 "
BHF,Brighthouse Financial Inc. Common Stock,Finance,Life Insurance,United States,," 4,002,288,561 "
ARVN,Arvinas Inc. Common Stock,Health Care,Major Pharmaceuticals,United States,2018," 3,999,388,157 "
RRC,Range Resources Corporation Common Stock,Energy,Oil & Gas Production,United States,," 3,998,445,113 "
LIVN,LivaNova PLC Ordinary Shares,Health Care,Biotechnology: Electromedical & Electrotherapeutic Apparatus,United Kingdom,," 3,995,981,805 "
CMC,Commercial Metals Company Common Stock,Basic Industries,Steel/Iron Ore,United States,," 3,988,893,247 "
ULCC,Frontier Group Holdings Inc. Common Stock,Transportation,Air Freight/Delivery Services,United States,2021," 3,985,400,296 "
CNMD,CONMED Corporation Common Stock,Health Care,Biotechnology: Electromedical & Electrotherapeutic Apparatus,United States,1987," 3,985,332,396 "
ORA,Ormat Technologies Inc. Common Stock,Public Utilities,Electric Utilities: Central,United States,2004," 3,977,131,208 "
AJRD,Aerojet Rocketdyne Holdings Inc. Common Stock,Capital Goods,Military/Government/Technical,United States,," 3,965,036,917 "
EBC,Eastern Bankshares Inc. Common Stock,Finance,Major Banks,United States,2020," 3,963,008,028 "
ARNA,Arena Pharmaceuticals Inc. Common Stock,Health Care,Major Pharmaceuticals,United States,2000," 3,956,785,278 "
EYE,National Vision Holdings Inc. Common Stock,Health Care,Ophthalmic Goods,United States,2017," 3,930,335,225 "
MTDR,Matador Resources Company Common Stock,Energy,Oil & Gas Production,United States,2012," 3,928,545,908 "
SWX,Southwest Gas Holdings Inc. Common Stock (DE),Public Utilities,Oil & Gas Production,United States,," 3,924,954,467 "
SIG,Signet Jewelers Limited Common Shares,Consumer Services,Consumer Specialties,Bermuda,," 3,914,183,137 "
SR,Spire Inc. Common Stock,Public Utilities,Oil/Gas Transmission,United States,," 3,911,625,972 "
SSRM,SSR Mining Inc. Common Stock,Basic Industries,Precious Metals,Canada,," 3,910,995,170 "
LGIH,LGI Homes Inc. Common Stock,Capital Goods,Homebuilding,United States,2013," 3,900,991,417 "
SBRA,Sabra Health Care REIT Inc. Common Stock,Consumer Services,Real Estate Investment Trusts,United States,," 3,897,540,146 "
SIM,Grupo Simec S.A.B. de C.V. American Depositary Shares,Basic Industries,Steel/Iron Ore,Mexico,1993," 3,888,905,589 "
